{
  "decision_id": "00000000-0000-4000-8000-000000000002",
  "operation_id": "00000000-0000-4000-8000-000000000001",
  "policy_id": "support-default",
  "policy_version": 1,
  "stage": "preview",
  "action": "redact",
  "findings": [
    {
      "rule_id": "PII.EMAIL",
      "category": "pii",
      "severity": "medium",
      "segment_id": "message-0",
      "start_byte": 8,
      "end_byte": 26,
      "detector_version": "rules-v1"
    }
  ],
  "reason_codes": [
    "PII_REDACTED"
  ]
}
